{
  "$schema": "schema/overview.schema.json",
  "id": "overview",
  "title": "Where we are",
  "summary": "Phase 4 (security) is in progress: 9 of 17 tasks done, and you re-approved the changed part pages. Claude continues with recovery from crashed pages.",
  "source": {
    "wiki_path": "STATUS.md",
    "content_hash": "sha256:77fc287dea973f8a832031bb9d6e43f36c644717229e69ec026a5b6f5fc3116e"
  },
  "updated": "2026-10-13",
  "where_we_are": [
    {
      "item": "Current phase",
      "state": "P4 Security: in progress",
      "ref": "phase-p4-security"
    },
    {
      "item": "Phase 3",
      "state": "Done, signed off by you on 13 Oct; end check rerun still owed",
      "ref": "phase-p3-tabs-sessions"
    },
    {
      "item": "Approvals",
      "state": "All up to date",
      "ref": "comp-security-engine"
    },
    {
      "item": "Your rule",
      "state": "Claude asks you before any delete or kill command"
    },
    {
      "item": "First upload to GitHub",
      "state": "After the end check and the history cleanup",
      "ref": "Q-221"
    }
  ],
  "next_action": {
    "who": "claude",
    "where_we_are": [
      {
        "item": "Phase 4",
        "state": "9 of 17 tasks done"
      },
      {
        "item": "Part pages",
        "state": "Re-approved by you"
      }
    ],
    "why": "Nothing to run; Claude continues with the next task: when a page's process crashes, the tab shows a clear state with a reload button, and Ferrum's window stays up.",
    "script": null,
    "tell_claude": "Nothing for now. Claude stops after Phase 4 for your review."
  },
  "questions_for_you": {
    "open": 19,
    "items": []
  }
}
